{
  "builder_version": "prospective-card-tracking-v1",
  "lane_results": [
    {
      "correction": null,
      "game_id": "2026_05_MIN_NO",
      "grade": "PENDING",
      "lane_key": "balanced",
      "official_score": null,
      "official_source_product_sha256": "1c4a9738d68577749209cdca621d1e89e1ac5b9a606ec771993dfbddef932d64",
      "official_source_publication_id": "publication-1c4a9738d68577749209cdca",
      "price_used_for_scoring": -130,
      "realized_units": null,
      "result_id": "result-3c3d069cc1f0a5e2d03b2460",
      "result_source": null,
      "result_source_provenance": null,
      "settled_at_utc": null,
      "units_risked": 0.75
    },
    {
      "correction": null,
      "game_id": "2026_05_DEN_LAC",
      "grade": "PENDING",
      "lane_key": "hit_rate",
      "official_score": null,
      "official_source_product_sha256": "1c4a9738d68577749209cdca621d1e89e1ac5b9a606ec771993dfbddef932d64",
      "official_source_publication_id": "publication-1c4a9738d68577749209cdca",
      "price_used_for_scoring": -180,
      "realized_units": null,
      "result_id": "result-da1579d822da147dca7b5474",
      "result_source": null,
      "result_source_provenance": null,
      "settled_at_utc": null,
      "units_risked": 0.5
    },
    {
      "correction": null,
      "game_id": "2026_05_SF_SEA",
      "grade": "PENDING",
      "lane_key": "value",
      "official_score": null,
      "official_source_product_sha256": "1c4a9738d68577749209cdca621d1e89e1ac5b9a606ec771993dfbddef932d64",
      "official_source_publication_id": "publication-1c4a9738d68577749209cdca",
      "price_used_for_scoring": -104,
      "realized_units": null,
      "result_id": "result-67ddc8a8f0805e0bdd493b01",
      "result_source": null,
      "result_source_provenance": null,
      "settled_at_utc": null,
      "units_risked": 0.75
    },
    {
      "correction": null,
      "game_id": "2026_05_BUF_LAR",
      "grade": "PENDING",
      "lane_key": "hit_rate",
      "official_score": null,
      "official_source_product_sha256": "a4e25cd48ef9273b74404942abe7dd4d6f86b2720740e16433e3d4509bedb410",
      "official_source_publication_id": "publication-a4e25cd48ef9273b74404942",
      "price_used_for_scoring": 154,
      "realized_units": null,
      "result_id": "result-e4183dad2a97341d18e33565",
      "result_source": null,
      "result_source_provenance": null,
      "settled_at_utc": null,
      "units_risked": 0.5
    },
    {
      "correction": null,
      "game_id": "2026_05_BUF_LAR",
      "grade": "PENDING",
      "lane_key": "balanced",
      "official_score": null,
      "official_source_product_sha256": "a4e25cd48ef9273b74404942abe7dd4d6f86b2720740e16433e3d4509bedb410",
      "official_source_publication_id": "publication-a4e25cd48ef9273b74404942",
      "price_used_for_scoring": -115,
      "realized_units": null,
      "result_id": "result-97f30d403842297e83ae2edd",
      "result_source": null,
      "result_source_provenance": null,
      "settled_at_utc": null,
      "units_risked": 0.75
    }
  ],
  "portfolio_results": [
    {
      "game_id": "2026_05_MIN_NO",
      "grade": "PENDING",
      "lane_keys": [
        "balanced"
      ],
      "portfolio_entry_id": "portfolio-7de7a8d2669dcaf9ac8541de",
      "price_used_for_scoring": -130,
      "realized_units": null,
      "units_risked": 0.75
    },
    {
      "game_id": "2026_05_DEN_LAC",
      "grade": "PENDING",
      "lane_keys": [
        "hit_rate"
      ],
      "portfolio_entry_id": "portfolio-517f635a8ecdca095e999ba3",
      "price_used_for_scoring": -180,
      "realized_units": null,
      "units_risked": 0.5
    },
    {
      "game_id": "2026_05_SF_SEA",
      "grade": "PENDING",
      "lane_keys": [
        "value"
      ],
      "portfolio_entry_id": "portfolio-aebbd6f15a85de7e936735c3",
      "price_used_for_scoring": -104,
      "realized_units": null,
      "units_risked": 0.75
    },
    {
      "game_id": "2026_05_BUF_LAR",
      "grade": "PENDING",
      "lane_keys": [
        "hit_rate"
      ],
      "portfolio_entry_id": "portfolio-555ccfe6bf341403a261215d",
      "price_used_for_scoring": 154,
      "realized_units": null,
      "units_risked": 0.5
    },
    {
      "game_id": "2026_05_BUF_LAR",
      "grade": "PENDING",
      "lane_keys": [
        "balanced"
      ],
      "portfolio_entry_id": "portfolio-8cdeb2158f1ba87501ac95a7",
      "price_used_for_scoring": -115,
      "realized_units": null,
      "units_risked": 0.75
    }
  ],
  "schema_version": "NFL_EDGE_PROSPECTIVE_CARD_RESULT_V1",
  "season": 2026,
  "settlement_status": "PENDING",
  "week": 5
}
