{
  "builder_version": "prospective-card-tracking-v1",
  "lane_results": [
    {
      "correction": null,
      "game_id": "2026_07_PIT_NO",
      "grade": "PENDING",
      "lane_key": "hit_rate",
      "official_score": null,
      "official_source_product_sha256": "cc0b5a5a611c59a88a69fab770e5fcafe481dcf81e565330bfd22bff02d4c7a9",
      "official_source_publication_id": "publication-cc0b5a5a611c59a88a69fab7",
      "price_used_for_scoring": -158,
      "realized_units": null,
      "result_id": "result-6ad5060138fe6ea3d7a9d59a",
      "result_source": null,
      "result_source_provenance": null,
      "settled_at_utc": null,
      "units_risked": 0.75
    },
    {
      "correction": null,
      "game_id": "2026_07_CLE_TEN",
      "grade": "PENDING",
      "lane_key": "balanced",
      "official_score": null,
      "official_source_product_sha256": "cc0b5a5a611c59a88a69fab770e5fcafe481dcf81e565330bfd22bff02d4c7a9",
      "official_source_publication_id": "publication-cc0b5a5a611c59a88a69fab7",
      "price_used_for_scoring": -130,
      "realized_units": null,
      "result_id": "result-9d82d0e74170a77c0a16e027",
      "result_source": null,
      "result_source_provenance": null,
      "settled_at_utc": null,
      "units_risked": 0.75
    },
    {
      "correction": null,
      "game_id": "2026_07_LAR_LV",
      "grade": "PENDING",
      "lane_key": "value",
      "official_score": null,
      "official_source_product_sha256": "cc0b5a5a611c59a88a69fab770e5fcafe481dcf81e565330bfd22bff02d4c7a9",
      "official_source_publication_id": "publication-cc0b5a5a611c59a88a69fab7",
      "price_used_for_scoring": -120,
      "realized_units": null,
      "result_id": "result-8b8d9d9a2805b48e937670b8",
      "result_source": null,
      "result_source_provenance": null,
      "settled_at_utc": null,
      "units_risked": 0.75
    },
    {
      "correction": null,
      "game_id": "2026_07_KC_SEA",
      "grade": "PENDING",
      "lane_key": "hit_rate",
      "official_score": null,
      "official_source_product_sha256": "421d7affc7bb45f5484ffa4e9994794e9bb505a7ba3b2bc2b10a9c00c7814cfb",
      "official_source_publication_id": "publication-421d7affc7bb45f5484ffa4e",
      "price_used_for_scoring": 138,
      "realized_units": null,
      "result_id": "result-5d3fae83627e5bac042d6492",
      "result_source": null,
      "result_source_provenance": null,
      "settled_at_utc": null,
      "units_risked": 0.5
    },
    {
      "correction": null,
      "game_id": "2026_07_DAL_PHI",
      "grade": "PENDING",
      "lane_key": "balanced",
      "official_score": null,
      "official_source_product_sha256": "39ce6c3621c5077c97a9294014922ec1251baf91e9ffc0fd0a018f878c6862f9",
      "official_source_publication_id": "publication-39ce6c3621c5077c97a92940",
      "price_used_for_scoring": -115,
      "realized_units": null,
      "result_id": "result-cc16eaa21f7e8bd858341e64",
      "result_source": null,
      "result_source_provenance": null,
      "settled_at_utc": null,
      "units_risked": 0.75
    }
  ],
  "portfolio_results": [
    {
      "game_id": "2026_07_PIT_NO",
      "grade": "PENDING",
      "lane_keys": [
        "hit_rate"
      ],
      "portfolio_entry_id": "portfolio-057c3c8911c00b313c40491f",
      "price_used_for_scoring": -158,
      "realized_units": null,
      "units_risked": 0.75
    },
    {
      "game_id": "2026_07_CLE_TEN",
      "grade": "PENDING",
      "lane_keys": [
        "balanced"
      ],
      "portfolio_entry_id": "portfolio-9b082b9fa3654619cd0fcbc3",
      "price_used_for_scoring": -130,
      "realized_units": null,
      "units_risked": 0.75
    },
    {
      "game_id": "2026_07_LAR_LV",
      "grade": "PENDING",
      "lane_keys": [
        "value"
      ],
      "portfolio_entry_id": "portfolio-8a0f9ffa9b68de362c3192b1",
      "price_used_for_scoring": -120,
      "realized_units": null,
      "units_risked": 0.75
    },
    {
      "game_id": "2026_07_KC_SEA",
      "grade": "PENDING",
      "lane_keys": [
        "hit_rate"
      ],
      "portfolio_entry_id": "portfolio-0e522c81900118d8a8e2cfba",
      "price_used_for_scoring": 138,
      "realized_units": null,
      "units_risked": 0.5
    },
    {
      "game_id": "2026_07_DAL_PHI",
      "grade": "PENDING",
      "lane_keys": [
        "balanced"
      ],
      "portfolio_entry_id": "portfolio-d1bb88bd413341e83ae615c5",
      "price_used_for_scoring": -115,
      "realized_units": null,
      "units_risked": 0.75
    }
  ],
  "schema_version": "NFL_EDGE_PROSPECTIVE_CARD_RESULT_V1",
  "season": 2026,
  "settlement_status": "PENDING",
  "week": 7
}
